{"iteration":44,"timestamp":"2026-03-29T02:55:00+03:00","commit":"3115841","run_dir":"20260329-023810","idea_id":"system-default-infra-keywords","score":89.5730846214186,"loss":387.3947119361444,"delta":-12.637607763055565,"model":"claude-sonnet-4-6","metrics":{"sufficiency":0.8675726729697318,"precision":0.8428293804041674,"consistency":1,"structure":1,"critical_miss_rate":0.34210526315789475,"loss":387.3947119361444,"score":89.5730846214186},"status":"keep","description":"System-default burden flip in REAL-INFRA; Unit→Integration dropped 10→5; loss improved -12.64","section":"KEY-QUESTIONS","edit_type":"add"}
{"iteration":45,"timestamp":"2026-03-29T03:15:00+03:00","commit":"603a567","run_dir":"20260329-025722","idea_id":"external-command-is-system","score":90.94874865836684,"loss":389.6828698991478,"delta":2.2881579630033884,"model":"claude-sonnet-4-6","metrics":{"sufficiency":0.8878226571903043,"precision":0.8559251256450043,"consistency":1,"structure":1,"critical_miss_rate":0.27631578947368424,"loss":389.6828698991478,"score":90.94874865836684},"status":"no-op","description":"Bright-line external-command→System rule. Integration→System 17→11, total errors 70→63, but loss +2.29 (calibration regression); borderline — reverted.","section":"KEY-QUESTIONS","edit_type":"add"}
{"iteration":46,"timestamp":"2026-03-29T07:35:00+03:00","commit":"89f7bed","run_dir":"20260329-071553","idea_id":"integration-brake-plus-llm-dep-burden","score":89.02321448572548,"loss":384.47193417652437,"delta":-2.9227782596200257,"model":"claude-sonnet-4-6","metrics":{"sufficiency":0.8557428787386219,"precision":0.8478678077550628,"consistency":1,"structure":1,"critical_miss_rate":0.3026315789473684,"loss":384.47193417652437,"score":89.02321448572548},"status":"keep","description":"LLM-DEP burden flip + INTEGRATION-BRAKE checkpoint; Int→System 17→13, Int→Unit 25→19, total errors 70→66","section":"KEY-QUESTIONS,SELF-CHECK","edit_type":"add"}
{"iteration":47,"timestamp":"2026-03-29T07:49:00+03:00","commit":"7e420c2","run_dir":"20260329-074201","idea_id":"remove-brake-add-unit-floor-guard","score":88.22231311981507,"loss":416.20896092114305,"delta":31.737026744618673,"model":"claude-sonnet-4-6","metrics":{"sufficiency":0.8455554361072937,"precision":0.8358382066956951,"consistency":1,"structure":1,"critical_miss_rate":0.3815789473684211,"loss":416.20896092114305,"score":88.22231311981507},"status":"discard","description":"Removed INTEGRATION-BRAKE: massive regression +31.74; BRAKE is load-bearing despite Unit→Integration side effect; reverted","section":"SELF-CHECK","edit_type":"remove"}
{"iteration":48,"timestamp":"2026-03-29T08:08:00+03:00","commit":"f5ce64a","run_dir":"20260329-080019","idea_id":"reasoning-commitment-lock","score":89.01801001711091,"loss":422.92322037170715,"delta":38.451285195182776,"model":"claude-sonnet-4-6","metrics":{"sufficiency":0.8608608662579251,"precision":0.8335331186462508,"consistency":1,"structure":1,"critical_miss_rate":0.3026315789473684,"loss":422.92322037170715,"score":89.01801001711091},"status":"discard","description":"Replaced SELF-CHECK with COMMIT-TO-REASONING: massive regression +38.45; SELF-CHECK is also load-bearing; reverted","section":"SELF-CHECK","edit_type":"replace"}
{"iteration":49,"timestamp":"2026-03-30T16:33:44.034Z","commit":null,"run_dir":"20260330-192600","idea_id":null,"score":90.71498479237385,"loss":397.03520232417003,"delta":0,"model":"gpt-5.3-codex","metrics":{"sufficiency":0.8897941507809928,"precision":0.8388153249709622,"consistency":1,"structure":1,"critical_miss_rate":0.27631578947368424,"loss":397.03520232417003,"score":90.71498479237385},"status":"baseline","description":"codex baseline on current treatment before 10-iteration medium/bigger-idea run","section":null,"edit_type":null}
{"iteration":50,"timestamp":"2026-03-30T16:41:27.585Z","commit":"87ba63f","run_dir":"20260330-193441","idea_id":"dual-pass-classify-then-audit","score":89.90084654757773,"loss":448.359323337233,"delta":51.32412101306295,"model":"gpt-5.3-codex","metrics":{"sufficiency":0.8757400572137414,"precision":0.8367571700410967,"consistency":1,"structure":1,"critical_miss_rate":0.32894736842105265,"loss":448.359323337233,"score":89.90084654757773},"status":"discard","description":"dual-pass-classify-then-audit: large regression (+51.32 loss); reverted","section":"SELF-CHECK decision flow","edit_type":"add"}
{"iteration":51,"timestamp":"2026-03-30T16:48:15.797Z","commit":"efc306a","run_dir":"20260330-194215","idea_id":"contrastive-boundary-examples-pack","score":89.4414654559598,"loss":423.9610412055974,"delta":26.925838881427353,"model":"gpt-5.3-codex","metrics":{"sufficiency":0.8747478544846966,"precision":0.8165166729650734,"consistency":1,"structure":1,"critical_miss_rate":0.3157894736842105,"loss":423.9610412055974,"score":89.4414654559598},"status":"discard","description":"contrastive-boundary-examples-pack: regression (+26.93 loss); reverted","section":"LEVEL-DEFS + SELF-CHECK","edit_type":"add"}
{"iteration":52,"timestamp":"2026-03-30T16:53:45.938Z","commit":"3b2714a","run_dir":"20260330-195103","idea_id":"boundary-proof-obligation-framework","score":88.41954472938865,"loss":510.56881238346125,"delta":113.53361005929122,"model":"gpt-5.3-codex","metrics":{"sufficiency":0.8582104756841598,"precision":0.8108984283379923,"consistency":1,"structure":1,"critical_miss_rate":0.35526315789473684,"loss":510.56881238346125,"score":88.41954472938865},"status":"discard","description":"boundary-proof-obligation-framework: major regression (+113.53 loss); reverted","section":"KEY-QUESTIONS -> SELF-CHECK","edit_type":"add"}
{"iteration":53,"timestamp":"2026-03-30T16:57:21.709Z","commit":"7f517ae","run_dir":"20260330-195418","idea_id":"evidence-ledger-decision-protocol","score":89.59130323189403,"loss":430.9729545492592,"delta":33.937752225089184,"model":"gpt-5.3-codex","metrics":{"sufficiency":0.8695779220779222,"precision":0.8382258758804167,"consistency":1,"structure":1,"critical_miss_rate":0.32894736842105265,"loss":430.9729545492592,"score":89.59130323189403},"status":"discard","description":"evidence-ledger-decision-protocol: regression (+33.94 loss); reverted","section":"pre KEY-QUESTIONS + MOCK-MISS","edit_type":"add"}
{"iteration":54,"timestamp":"2026-03-30T17:00:31.190Z","commit":"212cd0d","run_dir":"20260330-195744","idea_id":"solution-collapse-prevention","score":90.39629979072834,"loss":442.9867043511679,"delta":45.951502026997844,"model":"gpt-5.3-codex","metrics":{"sufficiency":0.884345912128807,"precision":0.8378637311821974,"consistency":1,"structure":1,"critical_miss_rate":0.2894736842105263,"loss":442.9867043511679,"score":90.39629979072834},"status":"discard","description":"solution-collapse-prevention: regression (+45.95 loss); reverted","section":"failure-first block + SELF-CHECK","edit_type":"add"}
{"iteration":55,"timestamp":"2026-03-30T17:03:40.091Z","commit":"d4967c6","run_dir":"20260330-200055","idea_id":"seam-map-cross-check","score":90.75556015755448,"loss":422.38521008835664,"delta":25.350007764186614,"model":"gpt-5.3-codex","metrics":{"sufficiency":0.8903875851244272,"precision":0.8392121487855493,"consistency":1,"structure":1,"critical_miss_rate":0.27631578947368424,"loss":422.38521008835664,"score":90.75556015755448},"status":"discard","description":"seam-map-cross-check: regression (+25.35 loss); reverted","section":"seam-map + SELF-CHECK","edit_type":"add"}
{"iteration":56,"timestamp":"2026-03-30T17:07:46.290Z","commit":"d9b7792","run_dir":"20260330-200455","idea_id":"two-pass-dependency-extraction","score":89.81807877522662,"loss":425.68851205594746,"delta":28.653309731777426,"model":"gpt-5.3-codex","metrics":{"sufficiency":0.8782327820814663,"precision":0.8257637880372979,"consistency":1,"structure":1,"critical_miss_rate":0.3157894736842105,"loss":425.68851205594746,"score":89.81807877522662},"status":"discard","description":"two-pass-dependency-extraction: regression (+28.65 loss); reverted","section":"two-pass dependency check + SELF-CHECK","edit_type":"add"}
{"iteration":57,"timestamp":"2026-03-30T17:10:36.742Z","commit":"8acd4ef","run_dir":"20260330-200818","idea_id":"system-environment-artifact-split","score":89.6150803008672,"loss":423.9098387430995,"delta":26.87463641892947,"model":"gpt-5.3-codex","metrics":{"sufficiency":0.8725706469456468,"precision":0.8311847359428306,"consistency":1,"structure":1,"critical_miss_rate":0.3157894736842105,"loss":423.9098387430995,"score":89.6150803008672},"status":"discard","description":"system-environment-artifact-split: regression (+26.87 loss); reverted","section":"REAL-INFRA","edit_type":"add"}
{"iteration":58,"timestamp":"2026-03-30T22:32:18.327Z","commit":"e0a0825","run_dir":"20260330-234454","idea_id":"deterministic-assertion-trap-block","score":89.67363849400229,"loss":380.78340526286013,"delta":-3.6885,"status":"keep","description":"deterministic-assertion-trap-block: add steering-the-LLM caution under LLM-DEP; improved loss vs latest claude baseline","section":"LLM-DEP","edit_type":"replace","model":"claude-sonnet-4-6","metrics":{"sufficiency":0.8693397013060324,"precision":0.8429977461085238,"consistency":1,"structure":1,"critical_miss_rate":0.3157894736842105,"loss":380.78340526286013,"score":89.67363849400229}}
{"iteration":59,"timestamp":"2026-03-30T22:45:48.202Z","commit":"9f01422","run_dir":"20260331-014020","idea_id":"integration-handoff-escalator","score":90.96531033792965,"loss":393.2152920499069,"delta":-3.8199,"status":"keep","description":"integration-handoff-escalator: add LLM handoff escalation under INTEGRATION-BRAKE; improved loss","section":"INTEGRATION-BRAKE","edit_type":"add","model":"gpt-5.3-codex","metrics":{"sufficiency":0.896185023796866,"precision":0.8337567014551017,"consistency":1,"structure":1,"critical_miss_rate":0.2631578947368421,"loss":393.2152920499069,"score":90.96531033792965}}
{"iteration":60,"timestamp":"2026-03-30T23:18:38.235Z","commit":"9daa8ed","run_dir":"20260331-021712","idea_id":"baseline","score":94.92609021501566,"loss":113.81346657937837,"delta":-279.4018,"status":"baseline","description":"synthetic baseline on changed tasks (ec-04,10,14,19,23,29,32,33,36) after A/B/C GT split","section":null,"edit_type":null,"model":"gpt-5.3-codex","metrics":{"sufficiency":0.9315118288144603,"precision":0.9346469815110167,"consistency":1,"structure":1,"critical_miss_rate":0.0967741935483871,"loss":113.81346657937837,"score":94.92609021501566}}
{"iteration":61,"timestamp":"2026-03-30T23:20:53.241Z","commit":"dc65e47","run_dir":"20260331-022037","idea_id":"baseline","score":93.02950862997464,"loss":364.6711389238024,"delta":250.8577,"status":"baseline","description":"synthetic full-corpus baseline (36 tasks): prior full run with ec-04,10,14,19,23,29,32,33,36 refreshed using post-split probes and current GT","section":null,"edit_type":null,"model":"gpt-5.3-codex","metrics":{"sufficiency":0.9194975048100049,"precision":0.8728572932712189,"consistency":1,"structure":1,"critical_miss_rate":0.20512820512820512,"loss":364.6711389238024,"score":93.02950862997464}}
{"iteration":62,"timestamp":"2026-03-30T23:38:42.455Z","commit":"fdab859","run_dir":"20260331-022843","idea_id":"rg-integration-dual-quote-gate-v1","score":null,"loss":null,"delta":null,"status":"crash","description":"iter aborted: codex usage limit and claude credit timeout/limit prevented full eval; treatment edit reverted","section":"REJECTION-GATE","edit_type":"add","model":"gpt-5.3-codex"}
{"iteration":63,"timestamp":"2026-04-10T20:59:55.168Z","commit":"fe1cc13","run_dir":"20260410-235407","idea_id":"integration-contract-invariant-gate","score":92.5914126413304,"loss":435.48553905369965,"delta":70.8144,"status":"discard","description":"integration-contract-invariant-gate: regression (+70.81 loss); reverted","section":"MOCK-MISS","edit_type":"add","model":"gpt-5.3-codex","metrics":{"sufficiency":0.9157816969823551,"precision":0.8611709653650444,"consistency":1,"structure":1,"critical_miss_rate":0.2564102564102564,"loss":435.48553905369965,"score":92.5914126413304}}
{"iteration":64,"timestamp":"2026-04-10T21:35:15.263Z","commit":"729d688","run_dir":"20260411-002056","idea_id":"competitive-critique-seeding","score":92.75901492919036,"loss":393.2398588951291,"delta":28.5687,"status":"discard","description":"competitive-critique-seeding: regression (+28.57 loss); reverted","section":"SELF-CHECK","edit_type":"add","model":"gpt-5.3-codex","metrics":{"sufficiency":0.9193517275783364,"precision":0.8701293376137639,"consistency":1,"structure":1,"critical_miss_rate":0.2564102564102564,"loss":393.2398588951291,"score":92.75901492919036}}
{"iteration":65,"timestamp":"2026-04-10T22:07:24.576Z","commit":"07a67b7","run_dir":"20260411-010159","idea_id":"determinism-test","score":92.55519985922948,"loss":441.816108830006,"delta":77.145,"status":"discard","description":"determinism-test (add-only clarifier): regression (+77.14 loss); reverted","section":"LLM-DEP","edit_type":"add","model":"gpt-5.3-codex","metrics":{"sufficiency":0.9144359228734231,"precision":0.8630612050595604,"consistency":1,"structure":1,"critical_miss_rate":0.2564102564102564,"loss":441.816108830006,"score":92.55519985922948}}
{"iteration":66,"timestamp":"2026-04-10T22:20:01.633Z","commit":"f9cfb63","run_dir":"20260411-011347","idea_id":"multi-candidate-test-design-then-select-lowest","score":92.64200185779133,"loss":431.9370586174996,"delta":67.2659,"status":"discard","description":"multi-candidate-test-design-then-select-lowest (add-only): regression (+67.27 loss); reverted","section":"KEY-QUESTIONS","edit_type":"add","model":"gpt-5.3-codex","metrics":{"sufficiency":0.9187299029349467,"precision":0.8555928598184629,"consistency":1,"structure":1,"critical_miss_rate":0.24358974358974358,"loss":431.9370586174996,"score":92.64200185779133}}
{"iteration":67,"timestamp":"2026-04-11T01:06:31.967Z","commit":"8cdd014","run_dir":"20260411-040028","idea_id":"agent-needs-working-memory-slots","score":92.49342951152164,"loss":395.7992428376324,"delta":31.1281,"status":"keep","description":"agent-needs-working-memory-slots v2 promotion trial: keep","section":"AGENT-MEMORY-SLOTS","edit_type":"add","model":"gpt-5.3-codex"}
{"iteration":68,"timestamp":"2026-04-11T01:06:57.437Z","commit":"1d0efa6","run_dir":"20260411-040028","idea_id":"agent-needs-working-memory-slots","score":92.49342951152164,"loss":395.7992428376324,"delta":31.1281,"status":"discard","description":"agent-needs-working-memory-slots v2 promotion trial: regression, reverted","section":"AGENT-MEMORY-SLOTS","edit_type":"add","model":"gpt-5.3-codex"}
{"iteration":69,"timestamp":"2026-04-11T16:36:16.392Z","commit":"9a59fbe","run_dir":"20260411-185628","idea_id":"baseline","score":93.5061,"loss":358.3884,"delta":-6.2827,"status":"baseline","description":"fresh full-corpus baseline rerun on committed treatment (HEAD) after promotion checks","section":"BASELINE","edit_type":null,"model":"gpt-5.3-codex","metrics":{"sufficiency":0.9259036309694204,"precision":0.8790692558030825,"consistency":1,"structure":1,"critical_miss_rate":0.18181818181818182,"loss":358.3883971094445,"score":93.50608481937977}}
{"iteration":70,"timestamp":"2026-04-11T17:44:50.075Z","commit":"9a59fbe","run_dir":"20260411-203850","idea_id":"baseline","score":93.7839457545026,"loss":391.7194293467982,"delta":33.331,"status":"baseline","description":"fresh full-corpus baseline rerun after GT+treatment updates","section":"BASELINE","edit_type":null,"model":"gpt-5.3-codex","metrics":{"sufficiency":0.9378704283857794,"precision":0.8600536096642362,"consistency":1,"structure":1,"critical_miss_rate":0.18181818181818182,"loss":391.7194293467982,"score":93.7839457545026}}
{"iteration":71,"timestamp":"2026-04-11T18:07:39.240Z","commit":"9a59fbe","run_dir":"20260411-210156","idea_id":"system-default-escalation-removal","score":93.74793244883348,"loss":372.07086137645183,"delta":-19.6486,"status":"keep","description":"system-default-escalation-removal: remove broad REAL-INFRA default + add SYSTEM TRIAD evidence guard","section":"REAL-INFRA","edit_type":"replace","model":"gpt-5.3-codex","metrics":{"sufficiency":0.9375413221055859,"precision":0.8591579866513123,"consistency":1,"structure":1,"critical_miss_rate":0.19480519480519481,"loss":372.07086137645183,"score":93.74793244883348}}
{"iteration":72,"timestamp":"2026-04-11T18:18:14.559Z","commit":"9a59fbe","run_dir":"20260411-211245","idea_id":"system-triad-contract-specificity-gate","score":93.48576545728052,"loss":364.4174162110753,"delta":-7.6534,"status":"keep","description":"system-triad-contract-specificity-gate: add contract-specificity constraint under SYSTEM TRIAD","section":"REAL-INFRA","edit_type":"add","model":"gpt-5.3-codex","metrics":{"sufficiency":0.9330810394545139,"precision":0.858315414364113,"consistency":1,"structure":1,"critical_miss_rate":0.22077922077922077,"loss":364.4174162110753,"score":93.48576545728052}}
{"iteration":73,"timestamp":"2026-04-12T05:45:59.801Z","commit":"06b7c3e","run_dir":"20260412-083957","idea_id":"workflow-cross-step-state-anchor","score":93.93966595351989,"loss":368.83496484794364,"delta":4.4175,"status":"discard","description":"workflow-cross-step-state-anchor: regression on full corpus after strong explore","section":"MULTI-STEP","edit_type":"add","model":"gpt-5.3-codex","metrics":{"sufficiency":0.9402174493197568,"precision":0.861385312046663,"consistency":1,"structure":1,"critical_miss_rate":0.16883116883116883,"loss":368.83496484794364,"score":93.93966595351989}}
{"iteration":74,"timestamp":"2026-04-12T06:00:12.045Z","commit":"999c13f","run_dir":"20260412-085421","idea_id":"workflow-anchor-combo-ab","score":94.51419705513433,"loss":364.6057974302844,"delta":0.1884,"status":"no-op","description":"workflow-anchor-combo-ab: near-tie full run, treated as no-op","section":"MULTI-STEP","edit_type":"add","model":"gpt-5.3-codex","metrics":{"sufficiency":0.9481999991773065,"precision":0.8681598550191229,"consistency":1,"structure":1,"critical_miss_rate":0.15584415584415584,"loss":364.6057974302844,"score":94.51419705513433}}
