{"iteration":0,"timestamp":"2026-03-27T17:20:22+03:00","commit":"d9ea7b9","run_dir":null,"idea_id":null,"score":87.2,"loss":null,"delta":0,"status":"baseline","description":"initial state — treatment prompt on 10-task corpus","section":null,"edit_type":null,"model":"claude-haiku-4-5-20251001"}
{"iteration":1,"timestamp":"2026-03-27T18:56:07+03:00","commit":null,"run_dir":null,"idea_id":null,"score":null,"loss":null,"delta":null,"status":"discard","description":"add concrete Agentic example and reorder key questions top-down (run 1 iter 1)","section":"LEVEL-DEFS, KEY-QUESTIONS","edit_type":"replace","model":"claude-haiku-4-5-20251001"}
{"iteration":2,"timestamp":"2026-03-27T19:00:06+03:00","commit":null,"run_dir":null,"idea_id":null,"score":null,"loss":null,"delta":null,"status":"discard","description":"expand Agentic definition with AI API examples — minimal change (run 1 iter 2)","section":"LEVEL-DEFS","edit_type":"replace","model":"claude-haiku-4-5-20251001"}
{"iteration":3,"timestamp":"2026-03-27T19:04:22+03:00","commit":null,"run_dir":null,"idea_id":null,"score":null,"loss":null,"delta":null,"status":"discard","description":"narrow System to exclude AI/LLM, clarify Agentic (run 1 iter 3)","section":"LEVEL-DEFS","edit_type":"replace","model":"claude-haiku-4-5-20251001"}
{"iteration":4,"timestamp":"2026-03-27T19:07:08+03:00","commit":null,"run_dir":null,"idea_id":null,"score":82.2,"loss":null,"delta":-5,"status":"discard","description":"add seam-based reasoning step (run 1 iter 4)","section":"KEY-QUESTIONS","edit_type":"add","model":"claude-haiku-4-5-20251001"}
{"iteration":5,"timestamp":"2026-03-27T19:10:00+03:00","commit":null,"run_dir":null,"idea_id":null,"score":null,"loss":null,"delta":null,"status":"discard","description":"run 1 iter 5 — unknown change, reverted (no score recorded)","section":null,"edit_type":null,"model":"claude-haiku-4-5-20251001"}
{"iteration":6,"timestamp":"2026-03-27T20:00:59+03:00","commit":"ebba0c3","run_dir":null,"idea_id":"minimize-bias-reframe","score":87.9,"loss":null,"delta":2.7,"status":"keep","description":"reframe 'choose LOWEST' to 'match the real failure boundary'","section":"FRAMING","edit_type":"replace","model":"claude-haiku-4-5-20251001"}
{"iteration":7,"timestamp":"2026-03-27T20:20:44+03:00","commit":"ecc589a","run_dir":null,"idea_id":"mock-exposes-nothing","score":89.9,"loss":null,"delta":2,"status":"keep","description":"add mock-exposes-nothing question before Agentic check","section":"KEY-QUESTIONS","edit_type":"add","model":"claude-haiku-4-5-20251001"}
{"iteration":8,"timestamp":"2026-03-27T20:43:41+03:00","commit":null,"run_dir":null,"idea_id":"failure-mode-taxonomy","score":86.8,"loss":null,"delta":-4.2,"status":"discard","description":"failure-mode-taxonomy: added failure type→level table — replaced LEVEL-DEFS","section":"LEVEL-DEFS","edit_type":"replace","model":"claude-haiku-4-5-20251001"}
{"iteration":9,"timestamp":"2026-03-28T12:52:13+03:00","commit":"4fc86a2","run_dir":"20260328-124120","idea_id":null,"score":89.5,"loss":null,"delta":0,"status":"baseline","description":"baseline run against corrected GT — 30-task corpus (GT revision: EC-18, EC-25 fixed)","section":null,"edit_type":null,"model":"claude-haiku-4-5-20251001"}
{"iteration":10,"timestamp":"2026-03-28T12:52:38+03:00","commit":null,"run_dir":"20260328-125244","idea_id":"challenge-your-choice","score":85.2,"loss":null,"delta":-4.3,"status":"discard","description":"challenge-your-choice: replaced SELF-CHECK with adversarial challenge","section":"SELF-CHECK","edit_type":"replace","model":"claude-haiku-4-5-20251001"}
{"iteration":11,"timestamp":"2026-03-28T13:06:11+03:00","commit":"803ef82","run_dir":null,"idea_id":null,"score":null,"loss":null,"delta":null,"status":"no-op","description":"name all prompt sections with bold labels (formatting only, no eval)","section":"ALL","edit_type":"add","model":"claude-haiku-4-5-20251001"}
{"iteration":12,"timestamp":"2026-03-28T13:07:09+03:00","commit":"ad2845b","run_dir":null,"idea_id":null,"score":null,"loss":null,"delta":null,"status":"no-op","description":"make LEVEL-DEFS bullets consistent with KEY-QUESTIONS (formatting only)","section":"LEVEL-DEFS","edit_type":"replace","model":"claude-haiku-4-5-20251001"}
{"iteration":13,"timestamp":"2026-03-28T13:07:38+03:00","commit":"cf5c7e5","run_dir":"20260328-131058","idea_id":null,"score":89.5,"loss":null,"delta":0,"status":"no-op","description":"consistent bullet/sub-bullet structure — 89.5 same as baseline (formatting confirmed neutral)","section":"ALL","edit_type":"replace","model":"claude-haiku-4-5-20251001"}
{"iteration":14,"timestamp":"2026-03-28T13:10:51+03:00","commit":null,"run_dir":"20260328-135203","idea_id":"swap-question-order-only","score":89.4,"loss":null,"delta":-0.1,"status":"no-op","description":"swap-question-order-only: moved LLM-DEP before REAL-INFRA — 89.4 within noise","section":"KEY-QUESTIONS","edit_type":"replace","model":"claude-haiku-4-5-20251001"}
{"iteration":15,"timestamp":"2026-03-28T14:23:00+03:00","commit":null,"run_dir":"20260328-142302","idea_id":null,"score":86.4,"loss":454.16,"delta":0,"status":"baseline","description":"loss baseline — first run with calibrated level_probabilities (same treatment.md as iter 9)","section":null,"edit_type":null,"model":"claude-haiku-4-5-20251001"}
{"iteration":16,"timestamp":"2026-03-28T15:00:00+03:00","commit":"23e85af","run_dir":"20260328-145025","idea_id":"variance-probe-question","score":84.4,"loss":447.92,"delta":-6.24,"status":"keep","description":"variance-probe-question: add 100-runs thought experiment under LLM-DEP — loss 447.92 vs baseline 454.16","section":"KEY-QUESTIONS","edit_type":"add","model":"claude-haiku-4-5-20251001"}
{"iteration":17,"timestamp":"2026-03-28T15:19:00+03:00","commit":null,"run_dir":"20260328-150512","idea_id":"module-coordination-probe","score":83,"loss":474.19,"delta":26.27,"status":"discard","description":"module-coordination-probe: add coordination-vs-logic Think line under MOCK-MISS — loss 474.19 vs 447.92, REVERTED","section":"KEY-QUESTIONS","edit_type":"add","model":"claude-haiku-4-5-20251001"}
{"iteration":18,"timestamp":"2026-03-28T15:40:00+03:00","commit":null,"run_dir":"20260328-152449","idea_id":"real-infra-probe","score":85.6,"loss":472.22,"delta":24.3,"status":"discard","description":"real-infra-probe: add Think line under REAL-INFRA targeting U3 — loss 472.22 vs 447.92, REVERTED. Run had partial rate-limit restart.","section":"KEY-QUESTIONS","edit_type":"add","model":"claude-haiku-4-5-20251001"}
{"iteration":19,"timestamp":"2026-03-28T16:10:00+03:00","commit":"a846ccc","run_dir":"20260328-155121","idea_id":"concrete-agentic-example","score":88,"loss":368.08,"delta":-79.84,"status":"keep","description":"concrete-agentic-example: expand Agentic definition with AI/ML examples — loss 368.08 vs 447.92, KEPT. Largest single improvement.","section":"LEVEL-DEFS","edit_type":"replace","model":"claude-haiku-4-5-20251001"}
{"iteration":20,"timestamp":"2026-03-28T16:33:00+03:00","commit":null,"run_dir":"20260328-162252","idea_id":"unit-algo-parenthetical","score":84.6,"loss":495.25,"delta":127.17,"status":"discard","description":"unit-algo-parenthetical: add algorithm parenthetical to Unit definition — loss 495.25 vs 368.08, REVERTED. Caused massive U2 over-triggering.","section":"LEVEL-DEFS","edit_type":"replace","model":"claude-haiku-4-5-20251001"}
{"iteration":21,"timestamp":"2026-03-28T17:13:00+03:00","commit":null,"run_dir":"20260328-170052","idea_id":"role-anchor-staff-engineer","score":84.6,"loss":469.89,"delta":101.81,"status":"discard","description":"role-anchor-staff-engineer: add staff engineer PR review persona — loss 469.89 vs 368.08, +101.81, REVERTED. Explore signal was misleading.","section":"end-of-prompt","edit_type":"add","model":"claude-haiku-4-5-20251001"}
{"iteration":22,"timestamp":"2026-03-28T17:41:00+03:00","commit":null,"run_dir":"20260328-173033","idea_id":"concrete-system-example","score":83.9,"loss":490.16,"delta":122.08,"status":"discard","description":"concrete-system-example: add parenthetical to System def — loss 490.16 vs 368.08, +122.08, REVERTED. O2 explosion (System over-prediction) overwhelmed any U3 fix.","section":"LEVEL-DEFS","edit_type":"replace","model":"claude-haiku-4-5-20251001"}
{"iteration":23,"timestamp":"2026-03-28T18:38:00+03:00","commit":null,"run_dir":"20260328-182058","idea_id":"framing-minimum-to-realistic","score":87.4,"loss":391.99,"delta":23.91,"status":"discard","description":"framing-minimum-to-realistic: change 'minimum' to 'realistic' in framing sentence — loss 391.99 vs 368.08, +23.91, REVERTED. Run assembled from 2 API calls (rate limit mid-run).","section":"framing","edit_type":"replace","model":"claude-haiku-4-5-20251001"}
{"iteration":24,"timestamp":"2026-03-28T18:55:00+03:00","commit":"dfb3a07","run_dir":"20260328-184249","idea_id":"mock-tests-your-mock","score":88.9,"loss":369.09,"delta":1.01,"status":"no-op","description":"mock-tests-your-mock: append anti-mock clause to Agentic definition — loss 369.09 vs 368.08, +1.01, NO-OP (within noise). REVERTED.","section":"LEVEL-DEFS","edit_type":"add","model":"claude-haiku-4-5-20251001"}
{"iteration":25,"timestamp":"2026-03-28T19:17:00+03:00","commit":"c3bae11","run_dir":"20260328-190539","idea_id":"reverse-self-check","score":89.1,"loss":374.65,"delta":6.57,"status":"discard","description":"reverse-self-check: flip SELF-CHECK from downgrade-invite to upward pressure — loss 374.65 vs 368.08, +6.57, REVERTED. Upward pressure too broad; schema fix also required (null plan_consistent_note).","section":"SELF-CHECK","edit_type":"replace","model":"claude-haiku-4-5-20251001"}
{"iteration":26,"timestamp":"2026-03-28T16:55:44.703Z","commit":null,"run_dir":"20260328-193534","idea_id":null,"score":93.06562902225053,"loss":366.5813686380502,"delta":0,"model":"gpt-5.3-codex","metrics":{"sufficiency":0.9349793724507346,"precision":0.8320881768730064,"consistency":1,"structure":1,"critical_miss_rate":0.16393442622950818,"loss":366.5813686380502,"score":93.06562902225053},"status":"baseline","description":"codex cold-start baseline on current treatment (first full 30-task run)","section":null,"edit_type":null}
{"iteration":27,"timestamp":"2026-03-28T17:04:22.179Z","commit":null,"run_dir":"20260328-195648","idea_id":"agentic-model-quality-disambiguation","score":93.99827149034891,"loss":306.7933489472134,"delta":-59.78801969083679,"model":"gpt-5.3-codex","metrics":{"sufficiency":0.9458162071846281,"precision":0.8489190047597167,"consistency":1,"structure":1,"critical_miss_rate":0.13114754098360656,"loss":306.7933489472134,"score":93.99827149034891},"status":"keep","description":"add LLM-DEP disambiguation: model judgment quality (classification/ranking/fraud scoring) => Agentic","section":"KEY-QUESTIONS","edit_type":"add"}
{"iteration":28,"timestamp":"2026-03-28T17:12:01.034Z","commit":null,"run_dir":"20260328-200721","idea_id":"agentic-quality-claims-over-wiring","score":94.68460820632184,"loss":293.46862266097185,"delta":-13.32472628624153,"model":"gpt-5.3-codex","metrics":{"sufficiency":0.9541512605042016,"precision":0.8603144439295367,"consistency":1,"structure":1,"critical_miss_rate":0.11475409836065574,"loss":293.46862266097185,"score":94.68460820632184},"status":"keep","description":"strengthen LLM-DEP rule: model-quality claims are Agentic even when surrounding wiring is Integration","section":"KEY-QUESTIONS","edit_type":"replace"}
{"iteration":29,"timestamp":"2026-03-28T17:17:54.305Z","commit":null,"run_dir":"20260328-201227","idea_id":"unit-direct-input-counterweight","score":92.90424542436695,"loss":341.64880950771783,"delta":48.18018684674598,"model":"gpt-5.3-codex","metrics":{"sufficiency":0.9239000073713695,"precision":0.8544872509470807,"consistency":1,"structure":1,"critical_miss_rate":0.18032786885245902,"loss":341.64880950771783,"score":92.90424542436695},"status":"discard","description":"add MOCK-MISS counterweight to keep Unit on direct deterministic function checks — loss worsened, reverted","section":"KEY-QUESTIONS","edit_type":"add"}
{"iteration":30,"timestamp":"2026-03-28T17:22:50.697Z","commit":null,"run_dir":"20260328-201805","idea_id":"workflow-retry-sequence-clarifier","score":93.60722616871146,"loss":335.8129178849317,"delta":42.34429522395984,"model":"gpt-5.3-codex","metrics":{"sufficiency":0.9414977861319966,"precision":0.8412423965725823,"consistency":1,"structure":1,"critical_miss_rate":0.14754098360655737,"loss":335.8129178849317,"score":93.60722616871146},"status":"discard","description":"add MULTI-STEP retry/state wording for Workflow — loss worsened, reverted","section":"KEY-QUESTIONS","edit_type":"add"}
{"iteration":31,"timestamp":"2026-03-28T17:27:35.954Z","commit":null,"run_dir":"20260328-202305","idea_id":"agentic-step-vs-agentic-workflow-reframe","score":92.56135482368225,"loss":354.4301726020838,"delta":60.96154994111196,"model":"gpt-5.3-codex","metrics":{"sufficiency":0.9245699108883318,"precision":0.8355004862411982,"consistency":1,"structure":1,"critical_miss_rate":0.19672131147540983,"loss":354.4301726020838,"score":92.56135482368225},"status":"discard","description":"reframe Agentic/Workflow as AI Agentic Step vs AI Agentic Workflow — loss worsened, reverted","section":"LEVEL-DEFS, KEY-QUESTIONS","edit_type":"replace"}
{"iteration":32,"timestamp":"2026-03-28T17:34:00.121Z","commit":"076e8c4","run_dir":"20260328-203359","idea_id":null,"score":91.63910643629103,"loss":446.26929341772404,"delta":0,"model":"gpt-5.3-codex","metrics":{"sufficiency":0.9111119590047606,"precision":0.8263974345514592,"consistency":1,"structure":1,"critical_miss_rate":0.21621621621621623,"loss":446.26929341772404,"score":91.63910643629103},"status":"baseline","description":"FAKE baseline (36 tasks): merged previous 30-task baseline outputs with EC-31..EC-36 run outputs","section":null,"edit_type":null}
{"iteration":33,"timestamp":"2026-03-28T17:40:47.506Z","commit":"076e8c4","run_dir":"20260328-204047","idea_id":null,"score":91.84583893989853,"loss":434.78930587121977,"delta":0,"model":"gpt-5.3-codex","metrics":{"sufficiency":0.9129968796396812,"precision":0.8315505279858025,"consistency":1,"structure":1,"critical_miss_rate":0.21052631578947367,"loss":434.78930587121977,"score":91.84583893989853},"status":"baseline","description":"FAKE baseline (36 tasks, corrected after split GT): merged 30-task baseline + refreshed EC-31..EC-36 outputs","section":null,"edit_type":null}
{"iteration":34,"timestamp":"2026-03-28T20:46:23+03:00","commit":"73901b3","run_dir":"20260328-204623","idea_id":null,"score":91.87424968039262,"loss":451.2267640517549,"delta":0,"model":"gpt-5.3-codex","metrics":{"sufficiency":0.9101128809223494,"precision":0.8409020614831695,"consistency":1,"structure":1,"critical_miss_rate":0.2236842105263158,"loss":451.2267640517549,"score":91.87424968039262},"status":"baseline","description":"fresh Codex baseline on full 36-task corpus before Iteration 1 edit","section":null,"edit_type":null}
{"iteration":35,"timestamp":"2026-03-28T22:58:30+03:00","commit":"73901b3","run_dir":"20260328-225446","idea_id":"integration-middle-anchor","score":90.32614167456401,"loss":460.30663431127067,"delta":9.079870259515766,"model":"gpt-5.3-codex","metrics":{"sufficiency":0.88486324167271,"precision":0.8329331691282476,"consistency":1,"structure":1,"critical_miss_rate":0.3026315789473684,"loss":460.30663431127067,"score":90.32614167456401},"status":"discard","description":"integration-middle-anchor (v1 anchor basic) on full corpus worsened loss; reverted prompt edit","section":"LEVEL-DEFS","edit_type":"add"}
{"iteration":26,"timestamp":"2026-03-28T23:05:00+03:00","commit":null,"run_dir":"20260328-225446","idea_id":null,"score":90.3,"loss":460.31,"delta":0,"model":"gpt-5.3-codex","status":"baseline","description":"codex baseline — first run with gpt-5.3-codex on 36-task corpus (ec-01 to ec-36, 6 new tasks added). Current treatment includes concrete-agentic-example.","section":null,"edit_type":null}
{"iteration":27,"timestamp":"2026-03-28T23:20:00+03:00","commit":"44acd15","run_dir":"20260328-231214","idea_id":"mock-miss-scope-clarification","score":92.0,"loss":390.59,"delta":-69.72,"model":"gpt-5.3-codex","status":"keep","description":"mock-miss-scope-clarification: scope MOCK-MISS to specific behavior failure mode — loss 390.59 vs codex baseline 460.31, -69.72, KEPT. O1 errors reduced (52→49), Integration→System over-prediction dropped (9→3).","section":"KEY-QUESTIONS","edit_type":"replace"}
{"iteration":36,"timestamp":"2026-03-28T23:35:00+03:00","commit":"73901b3","run_dir":"20260328-232623","idea_id":"precision-failure-boundary","score":90.13530195977437,"loss":431.0514128698268,"delta":40.4614128698268,"model":"gpt-5.3-codex","metrics":{"sufficiency":0.880118224855067,"precision":0.8364399796372836,"consistency":1,"structure":1,"critical_miss_rate":0.2894736842105263,"loss":431.0514128698268,"score":90.13530195977437},"status":"discard","description":"precision-failure-boundary one-line framing add worsened loss vs current reference (390.59); reverted","section":"end-of-prompt framing line","edit_type":"add"}
{"iteration":37,"timestamp":"2026-03-29T00:33:00+03:00","commit":"73901b3","run_dir":"20260329-002612","idea_id":"mock-miss-scope-clarification","score":91.93187664199597,"loss":390.2296181058246,"delta":-0.36038189417538927,"model":"gpt-5.3-codex","metrics":{"sufficiency":0.9100259328877749,"precision":0.844022516658417,"consistency":1,"structure":1,"critical_miss_rate":0.19736842105263158,"loss":390.2296181058246,"score":91.93187664199597},"status":"keep","description":"mock-miss-floor-not-ceiling follow-up: MOCK-MISS explicitly treated as Unit floor then re-apply REAL-INFRA/LLM-DEP/MULTI-STEP; loss improved slightly vs 390.59 reference.","section":"KEY-QUESTIONS","edit_type":"replace"}
{"iteration":38,"timestamp":"2026-03-29T00:48:00+03:00","commit":"73901b3","run_dir":"20260329-004233","idea_id":"self-check-hypothetical-wiring-guard","score":90.61927936342407,"loss":453.5252541054421,"delta":63.29563600000001,"model":"gpt-5.3-codex","metrics":{"sufficiency":0.8878469215969216,"precision":0.8393849337796705,"consistency":1,"structure":1,"critical_miss_rate":0.2894736842105263,"loss":453.5252541054421,"score":90.61927936342407},"status":"discard","description":"SELF-CHECK hypothetical-wiring guard caused major regression; reverted immediately.","section":"SELF-CHECK","edit_type":"add"}
{"iteration":39,"timestamp":"2026-03-29T01:03:00+03:00","commit":"73901b3","run_dir":"20260329-004857","idea_id":"mock-miss-scope-clarification","score":91.8652439326001,"loss":404.7839567234065,"delta":14.554338617581909,"model":"gpt-5.3-codex","metrics":{"sufficiency":0.9026130730867572,"precision":0.8610762456414223,"consistency":1,"structure":1,"critical_miss_rate":0.2631578947368421,"loss":404.7839567234065,"score":91.8652439326001},"status":"discard","description":"MOCK-MISS explicit evidence-text gate over-constrained Integration escalation and worsened loss; reverted.","section":"KEY-QUESTIONS","edit_type":"replace"}
{"iteration":40,"timestamp":"2026-03-29T01:22:10+03:00","commit":"3159c73","run_dir":"20260329-012210","idea_id":null,"score":87.1831321639126,"loss":439.539870048486,"delta":0,"model":"claude-sonnet-4-6","metrics":{"sufficiency":0.8322979005142318,"precision":0.8203373817814928,"consistency":1,"structure":1,"critical_miss_rate":0.39473684210526316,"loss":439.539870048486,"score":87.1831321639126},"status":"baseline","description":"sonnet baseline — first run with claude-sonnet-4-6 on 36-task corpus, treatment prompt","section":null,"edit_type":null}
{"iteration":41,"timestamp":"2026-03-29T01:53:00+03:00","commit":"5eb735e","run_dir":"20260329-014055","idea_id":"integration-escape-hatch","score":85.7215119318867,"loss":459.1839093157806,"delta":19.644039267294604,"model":"claude-sonnet-4-6","metrics":{"sufficiency":0.8034822850867742,"precision":0.8264993126057045,"consistency":1,"structure":1,"critical_miss_rate":0.42105263157894735,"loss":459.1839093157806,"score":85.7215119318867},"status":"discard","description":"INTEGRATION-CHECK bidirectional escape hatch worsened loss +19.64; down-test may have pushed correct Integration predictions to Unit; reverted","section":"KEY-QUESTIONS","edit_type":"add"}
{"iteration":42,"timestamp":"2026-03-29T02:05:00+03:00","commit":"8a1978f","run_dir":"20260329-015626","idea_id":"reject-higher-must-justify","score":87.22854262577044,"loss":412.4847073086922,"delta":-27.055162739793805,"model":"claude-sonnet-4-6","metrics":{"sufficiency":0.8307514839678153,"precision":0.8268605503770298,"consistency":1,"structure":1,"critical_miss_rate":0.39473684210526316,"loss":412.4847073086922,"score":87.22854262577044},"status":"keep","description":"REJECTION-GATE: force explicit disqualifying evidence when overriding a considered higher level; targets 43% self-aware errors","section":"SELF-CHECK","edit_type":"add"}
{"iteration":43,"timestamp":"2026-03-29T02:30:00+03:00","commit":"6a7f89b","run_dir":"20260329-021446","idea_id":"infra-probe-question","score":89.278820324842,"loss":400.03291769929996,"delta":-12.451789609392238,"model":"claude-sonnet-4-6","metrics":{"sufficiency":0.8605361108906001,"precision":0.8474667112929498,"consistency":1,"structure":1,"critical_miss_rate":0.3157894736842105,"loss":400.03291769929996,"score":89.278820324842},"status":"keep","description":"REAL-INFRA Think probe + contrastive Integration-vs-System examples; Integration→System dropped 19→15","section":"KEY-QUESTIONS","edit_type":"add"}
